{
  "based_on_event_hash": "sha256:3333333333333333333333333333333333333333333333333333333333333333",
  "config_checksum": "sha256:2222222222222222222222222222222222222222222222222222222222222222",
  "context_pack_id": "ctx_01J00000000000000000000001",
  "created_at": "2026-08-12T12:00:00Z",
  "excluded_object_ids": [],
  "fresh_until_event": null,
  "graph_cursor": 10,
  "included_evidence_ids": [
    "evd_01J00000000000000000000001"
  ],
  "included_object_ids": [
    "hyp_01J00000000000000000000001"
  ],
  "integrity": {
    "algorithm": "sha256",
    "canonicalization": "rfc8785",
    "content_hash": "sha256:2346b86d4536f3cae9b72552c1c6db8ca6ee312dd36d53a71409a6116bf496cb",
    "excluded_fields": [
      "integrity.content_hash"
    ]
  },
  "knowledge_policy": "knowledge_blind",
  "omitted_counts": {
    "global": 10,
    "learning": 0,
    "target": 0
  },
  "policy_checksum": "sha256:1111111111111111111111111111111111111111111111111111111111111111",
  "provenance": [
    {
      "license_or_terms": "private-test-fixture",
      "provenance_id": "prv_01J00000000000000000000001",
      "raw_hash": "sha256:bbbbbbbbbbbbbbbbbbbbbbbbbbbbbbbbbbbbbbbbbbbbbbbbbbbbbbbbbbbbbbbb",
      "retrieved_at": "2026-08-12T12:00:00Z",
      "source_uri": "https://fixtures.ayran.dev/m0",
      "source_version": "fixture-v1",
      "transformation_lineage": []
    }
  ],
  "purpose": "Gate A review",
  "query_ids": [
    "qry_01J00000000000000000000001"
  ],
  "role": "knowledge-blind-challenger",
  "run_id": "run_01J00000000000000000000001",
  "schema_version": "1.0.0",
  "sections": [
    {
      "classification": "POLICY",
      "content": "Operate only within approved scope.",
      "source_ids": [
        "scp_01J00000000000000000000001"
      ],
      "title": "Scope"
    }
  ],
  "target_identity": {
    "commit": "1111111111111111111111111111111111111111",
    "scope_id": "scp_01J00000000000000000000001",
    "source_tree_hash": "sha256:dddddddddddddddddddddddddddddddddddddddddddddddddddddddddddddddd",
    "target_id": "tgt_01J00000000000000000000001"
  },
  "token_estimate": 500
}
